{
  "$schema": "./schemas/aihub.schema.json",
  "$comment": "Cloud-only AIHub profile: every provider is a hosted LLM API — no local runtimes (ollama) and no CLI subprocess agents. Select it with AIHUB_CONFIG=config/aihub.cloud.json (or --config <path> on helios-ai, --aihub-config <path> on helios-ai-api). No secrets live here — only env-var names (Key Vault secret names as fallback). scripts/bootstrap/azure-up.sh provisions the Azure side and prints the env wiring.",
  "providers": {
    "azure-openai": {
      "type": "azure-openai",
      "model": "gpt-5-mini",
      "endpointEnv": "AZURE_OPENAI_ENDPOINT",
      "apiKeyEnv": "AZURE_OPENAI_API_KEY"
    },
    "azure-foundry": {
      "type": "azure-foundry-agent",
      "model": "gpt-5-mini",
      "endpointEnv": "AZURE_FOUNDRY_PROJECT_ENDPOINT"
    },
    "openai": {
      "type": "openai",
      "model": "gpt-4o-mini",
      "apiKeyEnv": "OPENAI_API_KEY",
      "apiKeySecretName": "openai-api-key"
    },
    "anthropic": {
      "type": "anthropic",
      "model": "claude-sonnet-4-5",
      "apiKeyEnv": "ANTHROPIC_API_KEY",
      "apiKeySecretName": "anthropic-api-key"
    },
    "anthropic-foundry": {
      "$comment": "Claude deployed in Microsoft Foundry (https://<resource>.services.ai.azure.com/anthropic). 'model' is the Foundry DEPLOYMENT name; endpointEnv is a bare resource name or an https base URL; a missing key falls back to Entra ID (DefaultAzureCredential) like azure-openai.",
      "type": "anthropic-foundry",
      "model": "claude-sonnet-4-6",
      "endpointEnv": "ANTHROPIC_FOUNDRY_RESOURCE",
      "apiKeyEnv": "ANTHROPIC_FOUNDRY_API_KEY",
      "apiKeySecretName": "anthropic-foundry-api-key"
    },
    "github-models": {
      "type": "github-models",
      "model": "openai/gpt-4o-mini",
      "apiKeyEnv": "GITHUB_MODELS_TOKEN",
      "apiKeySecretName": "github-models-token"
    }
  },
  "routing": {
    "$comment": "Keys of the form <taskType>:<language> are language-qualified chains: `helios-ai route <taskType> ... --language <language>` (and the language parameter of /v1/route and helios_ai_route) tries them before the bare task type, then routing.defaultChain. The language part is the normalized lower-case key (csharp, fsharp, cpp, python, powershell, bicep, yaml, json); outcomes record it so learning keys on (taskType, language). See docs/architecture/ROUTING_LANGUAGE_DIMENSION.md.",
    "defaultChain": ["azure-openai", "openai", "anthropic", "anthropic-foundry", "github-models"],
    "taskRouting": {
      "code_generation": ["azure-openai", "openai", "anthropic"],
      "code_generation:cpp": ["azure-openai", "openai", "anthropic", "anthropic-foundry"],
      "code_generation:fsharp": ["anthropic", "anthropic-foundry", "openai", "azure-openai"],
      "code_generation:python": ["azure-openai", "openai", "github-models", "anthropic"],
      "code_refactoring": ["anthropic", "openai", "azure-openai"],
      "test_creation": ["openai", "azure-openai", "anthropic"],
      "code_review": ["anthropic", "anthropic-foundry", "openai"],
      "code_review:bicep": ["anthropic", "anthropic-foundry", "azure-openai", "azure-foundry", "openai"],
      "code_review:powershell": ["anthropic", "anthropic-foundry", "openai", "github-models"],
      "long_context_analysis": ["anthropic", "anthropic-foundry"],
      "documentation_generation": ["anthropic", "anthropic-foundry", "openai", "github-models"],
      "code_analysis": ["anthropic", "anthropic-foundry", "openai"],
      "debugging": ["openai", "anthropic", "azure-openai"],
      "security_analysis": ["anthropic", "anthropic-foundry", "openai"],
      "architecture_design": ["anthropic", "anthropic-foundry", "openai"],
      "enterprise_data": ["azure-foundry", "anthropic-foundry", "azure-openai"],
      "inline_completion": ["github-models", "azure-openai"],
      "general_query": ["azure-openai", "openai", "github-models"]
    }
  },
  "learning": {
    "$comment": "On by default in the cloud profile: routed calls hit real paid APIs, so the adaptive reorder earns its keep immediately. Outcomes land in local JSONL (.helios/ is gitignored); switch mode to 'azure'/'hybrid' once AZURE_LEARNING_TABLE_ENDPOINT exists.",
    "enabled": true,
    "mode": "local",
    "localPath": ".helios/learning/outcomes.jsonl",
    "tableEndpointEnv": "AZURE_LEARNING_TABLE_ENDPOINT",
    "adaptiveRouting": true,
    "historyWindow": 200
  }
}
